SVG FILE,DESIGN FILE,ORDER-ID,ORDER-ITEM-ID,SKU,NUMBER-OF-ITEMS,TYPE,COLOUR,GRAPHIC,LINE_1,LINE_2,LINE_3,THEME,WARNINGS,IMAGE_PATH,DECORATIONTYPE,COLOR_PRIORITY
COLOUR_250504_004.svg,COLOUR_250504_004,026-7701425-6372310,48796532456042,OD045004_1Silver,1,regular stake,silver,Elegant.png,Graham John Glover,In loving memory,"24th February 1939 - 11th May 2019
A loving dad and grandad deeply missed",,,G:/My Drive/003 APPS/002 AmazonSeller/004 IMAGES\48796532456042.jpg,graphic,2
COLOUR_250504_004.svg,COLOUR_250504_004,206-0977008-2445922,48780839843042,OD045003,1,regular stake,silver,Rose.png,In Loving Memory of,Teresa Fletcher,"9th May 1950 - 29th March 2025

In our hearts you will always stay
Loved & remembered everyday",,,G:/My Drive/003 APPS/002 AmazonSeller/004 IMAGES\48780839843042.jpg,graphic,2
COLOUR_250504_004.svg,COLOUR_250504_004,026-0614866-8197957,48781348433402,OD045003,1,regular stake,silver,Plain.png,CAPTAINS,CHARITY BUNKER,"THERE’S A JAR ON THE BAR

THANK YOU",,,G:/My Drive/003 APPS/002 AmazonSeller/004 IMAGES\48781348433402.jpg,graphic,2
COLOUR_250504_004.svg,COLOUR_250504_004,206-9368915-0598702,48806943197482,OD042030Silver,1,regular stake,silver,OD042030Silver.png,,Cherry's,Bird Bath,,,G:/My Drive/003 APPS/002 AmazonSeller/004 IMAGES\48806943197482.jpg,graphic,2
COLOUR_250504_004.svg,COLOUR_250504_004,701-9325885-9149852,126928591285201,OD045003CA,1,regular stake,silver,Rose.png,In loving memory of,Brenda Morphet,"Mother, Grandma , Partner and Friend
Forever in our hearts",,,G:/My Drive/003 APPS/002 AmazonSeller/004 IMAGES\126928591285201.jpg,graphic,2
